<tariffs xmlns:xsi="http://www.w3.org/2001/XMLSchema-instance"
         xmlns="http://www.example.com/tariffs"
         xsi:schemaLocation="http://www.example.com/tariffs tariffs.xsd">
    <tariff>
        <id>0</id>
        <name>name</name>
        <operator-name>operator</operator-name>
        <payroll>0.00</payroll>
        <sms-price>0.00</sms-price>
        <call-prices>
            <same-operator>0.00</same-operator>
            <another-operator>0.00</another-operator>
            <landline-phones>0.00</landline-phones>
        </call-prices>
    </tariff>
    <tariff>
        <id>1</id>
        <name>name1</name>
        <operator-name>operator1</operator-name>
        <payroll>1.11</payroll>
        <sms-price>1.11</sms-price>
        <call-prices>
            <same-operator>1.11</same-operator>
            <another-operator>1</another-operator>
            <landline-phones>1</landline-phones>
        </call-prices>
    </tariff>
    <tariff>
        <id>2</id>
        <name>name2</name>
        <operator-name>operator2</operator-name>
        <payroll>2.22</payroll>
        <sms-price>2.22</sms-price>
        <call-prices>
            <same-operator>2.22</same-operator>
            <another-operator>2.22</another-operator>
            <landline-phones>2.22</landline-phones>
        </call-prices>
    </tariff>
    <tariff-with-internet>
        <id>3</id>
        <name>name3</name>
        <operator-name>operator3</operator-name>
        <payroll>3.33</payroll>
        <sms-price>3.33</sms-price>
        <call-prices>
            <same-operator>3.33</same-operator>
            <another-operator>3.33</another-operator>
            <landline-phones>3.33</landline-phones>
        </call-prices>
        <traffic-in-megabyte>333</traffic-in-megabyte>
        <price-for-one-megabyte>3</price-for-one-megabyte>
        <is-modem-mode-enabled>true</is-modem-mode-enabled>
    </tariff-with-internet>
    <tariff-with-internet>
        <id>4</id>
        <name>name4</name>
        <operator-name>operator4</operator-name>
        <payroll>4.44</payroll>
        <sms-price>4</sms-price>
        <call-prices>
            <same-operator>4</same-operator>
            <another-operator>4.44</another-operator>
            <landline-phones>4.44</landline-phones>
        </call-prices>
        <traffic-in-megabyte>444.4</traffic-in-megabyte>
        <price-for-one-megabyte>44.4</price-for-one-megabyte>
        <is-modem-mode-enabled>false</is-modem-mode-enabled>
    </tariff-with-internet>
</tariffs>